{
  "schema_version": 3,
  "package_id": "training-05-yellow-river",
  "title": "黄河水沙监测数据分析",
  "finalization_status": "ready_for_review",
  "generated_from_process": true,
  "writer_entrypoint": "final",
  "process_policy": "noncanonical",
  "source_files": [
    "source/problem/E题.pdf",
    "source/attachments/附件1.xlsx",
    "source/attachments/附件2.xlsx",
    "source/attachments/附件3.xlsx"
  ],
  "external_input_note": "官方题面和三个附件均位于source/；无包外必需输入。",
  "common_files": [
    "final/README.md",
    "final/common/assumptions.md",
    "final/common/notation.md",
    "final/common/dependency-map.md",
    "final/common/decision-log.md"
  ],
  "common_provenance": [
    {
      "final_artifact": "final/README.md",
      "process_sources": [
        "process/README.md",
        "process/q1/decisions/d01-adopt-log-linear-sediment.md",
        "process/q2/decisions/d01-adopt-interpolated-daily-pattern.md",
        "process/q3/decisions/d03-adopt-forecast-and-cost-sampling.md",
        "process/q4/decisions/d09-adopt-bounded-aggradation.md"
      ]
    },
    {
      "final_artifact": "final/common/assumptions.md",
      "process_sources": [
        "process/q1/routes/r01-log-linear-sediment/route.md",
        "process/q3/routes/r05-cost-constrained-sampling/route.md",
        "process/q4/routes/r04-bounded-aggradation/model/bounded-aggradation-model.md"
      ]
    },
    {
      "final_artifact": "final/common/notation.md",
      "process_sources": [
        "process/q1/routes/r01-log-linear-sediment/notes/question1-method.md",
        "process/q4/routes/r01-cross-section-counterfactual/model/multiyear-tiered-effect-evaluation.md",
        "process/q4/routes/r04-bounded-aggradation/model/bounded-aggradation-model.md"
      ]
    },
    {
      "final_artifact": "final/common/dependency-map.md",
      "process_sources": [
        "process/q1/README.md",
        "process/q2/README.md",
        "process/q3/README.md",
        "process/q4/README.md"
      ]
    },
    {
      "final_artifact": "final/common/decision-log.md",
      "process_sources": [
        "process/q1/decisions/d01-adopt-log-linear-sediment.md",
        "process/q2/decisions/d01-adopt-interpolated-daily-pattern.md",
        "process/q3/decisions/d03-adopt-forecast-and-cost-sampling.md",
        "process/q3/comparisons/compare-q3-forecast-routes.md",
        "process/q4/comparisons/compare-q4-working-solution.md",
        "process/q4/comparisons/compare-ten-year-forecast-models.md",
        "process/q4/decisions/d09-adopt-bounded-aggradation.md"
      ]
    }
  ],
  "unresolved_decisions": [],
  "questions": [
    {
      "id": "q1",
      "solution": "final/q1/solution.md",
      "source_inputs": [
        "source/attachments/附件1.xlsx"
      ],
      "final_code": [
        "final/q1/code/analyze_question1.py"
      ],
      "no_code_reason": "",
      "final_results": [
        "final/q1/full-solution.md",
        "final/q1/results/summary.md",
        "final/q1/results/annual_flux_estimates.csv"
      ],
      "no_machine_results_reason": "",
      "final_figures": [],
      "validation": {
        "status": "partial",
        "artifacts": [
          "final/q1/validation/summary.md",
          "final/q1/validation/model_validation.csv",
          "final/q1/validation/annual_flux_holdout_validation.csv",
          "final/q1/validation/annual_sediment_uncertainty.csv"
        ],
        "gap_reason": "含沙量87.13%由模型补全；年度留出只覆盖实测含沙量稀疏网格，移动块自助只描述模型内不确定性，不能验证完整真实年度误差覆盖。",
        "affected_conclusion": "年度排沙点估计及其经验区间不能表述为完整真值或正式覆盖率已验证。"
      },
      "route_decisions": {
        "adopted": [
          {
            "artifact": "process/q1/routes/r01-log-linear-sediment/route.md",
            "reason": "d01正式采用；完整思路保留于full-solution.md，2032成功run提供当前输入、结果、模型比较和时间块不确定性证据。"
          }
        ],
        "supporting": [],
        "rejected": [],
        "superseded": [],
        "unresolved": []
      },
      "provenance": [
        {
          "final_artifact": "final/q1/solution.md",
          "process_sources": [
            "process/q1/routes/r01-log-linear-sediment/notes/question1-method.md",
            "process/q1/routes/r01-log-linear-sediment/runs/run-20260809-2032-time-block-bootstrap/results/analysis.md",
            "process/q1/routes/r01-log-linear-sediment/runs/run-20260809-2032-time-block-bootstrap/validation/validation_summary.md"
          ]
        },
        {
          "final_artifact": "final/q1/full-solution.md",
          "process_sources": [
            "process/q1/routes/r01-log-linear-sediment/notes/question1-method.md"
          ]
        },
        {
          "final_artifact": "final/q1/code/analyze_question1.py",
          "process_sources": [
            "process/q1/routes/r01-log-linear-sediment/code/analyze_question1.py"
          ]
        },
        {
          "final_artifact": "final/q1/results/summary.md",
          "process_sources": [
            "process/q1/routes/r01-log-linear-sediment/runs/run-20260809-2032-time-block-bootstrap/results/analysis.md"
          ]
        },
        {
          "final_artifact": "final/q1/results/annual_flux_estimates.csv",
          "process_sources": [
            "process/q1/routes/r01-log-linear-sediment/runs/run-20260809-2032-time-block-bootstrap/results/tables/annual_flux_estimates.csv"
          ]
        },
        {
          "final_artifact": "final/q1/validation/summary.md",
          "process_sources": [
            "process/q1/routes/r01-log-linear-sediment/runs/run-20260809-2032-time-block-bootstrap/validation/validation_summary.md"
          ]
        },
        {
          "final_artifact": "final/q1/validation/model_validation.csv",
          "process_sources": [
            "process/q1/routes/r01-log-linear-sediment/runs/run-20260809-2032-time-block-bootstrap/validation/model_validation.csv"
          ]
        },
        {
          "final_artifact": "final/q1/validation/annual_flux_holdout_validation.csv",
          "process_sources": [
            "process/q1/routes/r01-log-linear-sediment/runs/run-20260809-2032-time-block-bootstrap/validation/annual_flux_holdout_validation.csv"
          ]
        },
        {
          "final_artifact": "final/q1/validation/annual_sediment_uncertainty.csv",
          "process_sources": [
            "process/q1/routes/r01-log-linear-sediment/runs/run-20260809-2032-time-block-bootstrap/validation/annual_sediment_uncertainty.csv"
          ]
        }
      ]
    },
    {
      "id": "q2",
      "solution": "final/q2/solution.md",
      "source_inputs": [
        "source/attachments/附件1.xlsx"
      ],
      "final_code": [
        "final/q2/code/analyze_question2.py"
      ],
      "no_code_reason": "",
      "final_results": [
        "final/q2/full-solution.md",
        "final/q2/results/summary.md",
        "final/q2/results/annual_flux_pattern.csv",
        "final/q2/results/abrupt_change_events.csv",
        "final/q2/results/periodicity_summary.csv"
      ],
      "no_machine_results_reason": "",
      "final_figures": [
        "final/q2/figures/monthly-mean-flow.png",
        "final/q2/figures/monthly-mean-sediment-flux.png",
        "final/q2/figures/monthly-normalized-flux.png",
        "final/q2/figures/monthly-water-sediment-share.png"
      ],
      "validation": {
        "status": "partial",
        "artifacts": [
          "final/q2/validation/summary.md",
          "final/q2/validation/interpolation_sensitivity_summary.csv",
          "final/q2/validation/abrupt_event_stability.csv",
          "final/q2/validation/periodicity_robustness.csv"
        ],
        "gap_reason": "沙通量继承q1补全误差；突变候选对参数敏感且无外部事件标签；六年样本不足以验证长期周期稳定性。",
        "affected_conclusion": "只能声称样本内季节集中、算法突变候选和较强年尺度成分，不能作因果或长期稳定性结论。"
      },
      "route_decisions": {
        "adopted": [
          {
            "artifact": "process/q2/routes/r01-interpolated-daily-pattern/route.md",
            "reason": "d01正式采用；完整思路保留于full-solution.md，2036成功run绑定q1当前输入并包含插值、突变和周期稳健性。"
          }
        ],
        "supporting": [],
        "rejected": [],
        "superseded": [],
        "unresolved": []
      },
      "provenance": [
        {
          "final_artifact": "final/q2/solution.md",
          "process_sources": [
            "process/q2/routes/r01-interpolated-daily-pattern/notes/question2-method.md",
            "process/q2/routes/r01-interpolated-daily-pattern/runs/run-20260809-2036-time-block-q1/results/reports/question2-analysis.md"
          ]
        },
        {
          "final_artifact": "final/q2/full-solution.md",
          "process_sources": [
            "process/q2/routes/r01-interpolated-daily-pattern/notes/question2-method.md"
          ]
        },
        {
          "final_artifact": "final/q2/code/analyze_question2.py",
          "process_sources": [
            "process/q2/routes/r01-interpolated-daily-pattern/code/analyze_question2.py"
          ]
        },
        {
          "final_artifact": "final/q2/results/summary.md",
          "process_sources": [
            "process/q2/routes/r01-interpolated-daily-pattern/runs/run-20260809-2036-time-block-q1/results/reports/question2-analysis.md"
          ]
        },
        {
          "final_artifact": "final/q2/results/annual_flux_pattern.csv",
          "process_sources": [
            "process/q2/routes/r01-interpolated-daily-pattern/runs/run-20260809-2036-time-block-q1/results/tables/annual_flux_pattern.csv"
          ]
        },
        {
          "final_artifact": "final/q2/results/abrupt_change_events.csv",
          "process_sources": [
            "process/q2/routes/r01-interpolated-daily-pattern/runs/run-20260809-2036-time-block-q1/results/tables/abrupt_change_events.csv"
          ]
        },
        {
          "final_artifact": "final/q2/results/periodicity_summary.csv",
          "process_sources": [
            "process/q2/routes/r01-interpolated-daily-pattern/runs/run-20260809-2036-time-block-q1/results/tables/periodicity_summary.csv"
          ]
        },